item_id,claim_id,paper_id,stratum,source_location,source_excerpt,P,B_A,B_B,M,R,code_claim_card_specifiable,code_scalar_directional,code_relation_type,code_planning_feasible,code_auditable_design,code_design_type,code_materialization_boundary,code_T1_exact_defensible
S101,ext_2304_03829v1_claim3,2304.03829v1,non_exact_auditable,,,oracle synthesis preprocessing,ESOP alone,ESOP with RTT preprocessing,time-to-synthesis,A < B,,,,,,,,
S102,ext_2304_08814v2_claim6,2304.08814v2,non_exact_auditable,line 565,"Steiner-GraySynth are an order of magnitude faster than Qiskit and TKET, even though the additional iterations of Reverse Traversal increased the normal",,,,,,,,,,,,,
S103,ext_2304_08814v2_claim7,2304.08814v2,non_exact_auditable,line 556,"compiler. For small circuits, TKET is the best compiler, but for larger circuits, ParitySynth and Steiner-GraySynth generated fewer CNOTs. We can see the",,,,,,,,,,,,,
S104,ext_2305_03390v1_claim2,2305.03390v1,non_exact_auditable,line 644,"Continuing with the circuit depth (also displayed in figure 8), we can observe a clear disadvantage of the PUBO approach when",continuous optimization with QAOA,QUBO approach,PUBO approach,circuit_depth,A < B,,,,,,,,
S105,ext_2308_01789v1_claim2,2308.01789v1,non_exact_auditable,line 394,"Furthermore, V Ans builds circuits with the lowest number of gates and cnot gates, probably because it is the only algorit hm",,,,,,,,,,,,,
S106,ext_2308_02536v1_legacy_claim2,2308.02536v1,non_exact_auditable,,,,,,,,,,,,,,,
S107,ext_2308_10383v2_claim4,2308.10383v2,non_exact_auditable,,,,,,,,,,,,,,,
S108,ext_2309_00047v1_claim1,2309.00047v1,non_exact_auditable,,,MaxCut ADAPT-QAOA,Dynamic-ADAPT-QAOA,ADAPT-QAOA,cnot_count_at_approximation_ratio,A < B,,,,,,,,
S109,ext_2309_00047v1_claim2,2309.00047v1,non_exact_auditable,,,MaxCut under gate noise,Dynamic-ADAPT-QAOA,standard ADAPT-QAOA,approximation_ratio,A > B,,,,,,,,
S110,ext_2309_00047v1_claim3,2309.00047v1,non_exact_auditable,,,MaxCut under gate noise,Dynamic-ADAPT-QAOA,standard ADAPT-QAOA,critical_gate_error_probability,A > B,,,,,,,,
S111,ext_2309_00047v1_claim5,2309.00047v1,non_exact_auditable,line 1284,"mitigation. These are depicted in FIG. 9. The data shows that applying error mitigation, even if it is just to secondorder, we can improve, on average, the outputted approximation ratio by Dynamic-ADAPT-QAOA. Additionally, extending this technique to other versions of QAOA should be analogous. Howev",Dynamic-ADAPT-QAOA under gate error,error-mitigated Dynamic-ADAPT-QAOA,unmitigated Dynamic-ADAPT-QAOA,mean_approximation_ratio,A > B,,,,,,,,
S112,ext_2309_04754v1_claim1,2309.04754v1,non_exact_auditable,line 84,1. Exponential saving on input state copies: To achieve arbitrarily precise estimates of all function evaluations that one encounters during an iterative optimization of the,,,,,,,,,,,,,
S113,ext_2309_05157v1_claim1,2309.05157v1,non_exact_auditable,,,,,,,,,,,,,,,
S114,ext_2309_05157v1_claim2,2309.05157v1,non_exact_auditable,,,,,,,,,,,,,,,
S115,ext_2309_05157v1_claim6,2309.05157v1,non_exact_auditable,line 514,"while Qiskit beats the direct AceCR(θ) implementation for γ ∈ { 0.25π, 0.75π, π}, future iterations of Superstaq will",two-qubit QAOA direct AceCR implementation on IBM hardware,Qiskit calibrated implementation,direct AceCR(theta) implementation,Hellinger fidelity,A > B,,,,,,,,
S116,ext_2309_16796v3_claim1,2309.16796v3,non_exact_auditable,line 518,QAOA circuits. We attempt to incorporate the quantum speedup from parallelism with the exploitation-exploration accuracy benefits of metaheuristic algorithms. Our research provides a novel insight into the applications of metaheuristicboosted QAOA circuits and their comparisons against Quantum Annea,QUBO/NPP optimization,metaheuristic-integrated QAOA,standard QAOA,accuracy,A > B,,,,,,,,
S117,ext_2309_16796v3_claim2,2309.16796v3,non_exact_auditable,,,QAOA optimizer comparison,QAOA with Ant Colony Swarm Optimization,QAOA with DE/PSO/GA and standard QAOA,accuracy,A > B,,,,,,,,
S118,ext_2309_16796v3_claim3,2309.16796v3,non_exact_auditable,,,QAOA optimizer comparison,standard QAOA,metaheuristic-optimized QAOA,time complexity,A < B,,,,,,,,
S119,ext_2310_10360v2_claim2,2310.10360v2,non_exact_auditable,line 375,"graphs. Remarkably enough, the resultant approximation ratios are higher as compared to those of the classical GoemansWilliamson algorithm. We believe that our results might be useful for future research to overcome optimization issues in",max-k-cut approximation benchmarking,PROTES-optimized QAOA,Goemans-Williamson algorithm,approximation ratio,A > B,,,,,,,,
S120,ext_2311_02151v2_claim1,2311.02151v2,specifiable_positive_fill,,,spin-glass QAOA scaling,standard QAOA,parity-encoded QAOA,scaling advantage/runtime justification,A > B,,,,,,,,
