item_id,claim_id,paper_id,stratum,source_location,source_excerpt,P,B_A,B_B,M,R,code_claim_card_specifiable,code_scalar_directional,code_relation_type,code_planning_feasible,code_auditable_design,code_design_type,code_materialization_boundary,code_T1_exact_defensible
S001,ext_2202_14025v1_legacy_claim12,2202.14025v1,exact_T1,line 725,"by each compilation stage, see Fig. 12(b). We found that Pytket with the backend implemented in C++ showed the best runtime performance. Qiskit, PyZX and Cirq fully implemented in Python have comparable execution times.",,,,,,,,,,,,,
S002,ext_2202_14025v1_legacy_claim6,2202.14025v1,exact_T1,line 605,"Both algorithms show somewhat diﬀerent performance according to CX depth overhead, where Transpile (Qiskit) outperforms DefaultMapping (Pytket) for densely connected graphs with node degrees k ≳ 8.",,,,,,,,,,,,,
S003,ext_2304_08814v2_claim5,2304.08814v2,exact_T1,,,,,,,,,,,,,,,
S004,ext_2409_08844v2_claim1,2409.08844v2,exact_T1,,,,,,,,,,,,,,,
S005,ext_2409_08844v2_claim3,2409.08844v2,exact_T1,line 614,"emerge. First, we see that, as a whole, Qiskit outperforms BQSKit, Staq, and Tket in terms of 2Q gate count; a trend clearly seen in the BQSKit and Tket data. This is",,,,,,,,,,,,,
S006,ext_2409_08844v2_claim4,2409.08844v2,exact_T1,,,,,,,,,,,,,,,
S007,ext_2411_00518v2_claim1,2411.00518v2,exact_T1,line 96,conduct numerical experiments for our method on the same benchmark instances as for the Copula-QAOA and demonstrate that our method is able to provide higher approximation,,,,,,,,,,,,,
S008,ext_2411_00518v2_claim3,2411.00518v2,exact_T1,line 949,"noted, however, that it achieves significantly better probability values between five and ten items compared to the QTGbased AAM-QAOA, with the global maxima being around",,,,,,,,,,,,,
S009,ext_2005_11011v2_claim3,2005.11011v2,non_specifiable,line 782,"deviation. In this scenario, Nelder-Mead is the least resilient to this noise, while MPG is the most, and MGD follows.",VQA optimizer resilience to gate rotation error,MPG optimizer,Nelder-Mead optimizer,noise resilience,A > B,,,,,,,,
S010,ext_2008_02941v2_claim2,2008.02941v2,non_specifiable,line 654,state. We see that the average HVA state is more entangled than the ground states of interest.,HVA entanglement characterization,average HVA state,ground states of interest,entanglement,A > B,,,,,,,,
S011,ext_2108_02099v2_claim3,2108.02099v2,non_specifiable,line 1644,"1.6x and 2.9x compared to t |ket⟩ and Qiskit, respectively. Figure 13 shows the compilation results of 3-layer QAOA",QAOA compilation depth reduction,proposed method (Quanto),t|ket> and Qiskit,circuit depth,A < B,,,,,,,,
S012,ext_2202_14025v1_legacy_claim11,2202.14025v1,non_specifiable,line 701,"(c) For random phase polynomial [ CX, Rz] circuits, PyZX outperforms competitors by a large margin in terms of CX count reduction, although by the expense of increasing of single-qubit gate count. This behaviour is",random phase-polynomial circuit compression,PyZX,Qiskit/Pytket/Cirq competitors,CX count reduction (single-qubit cost),A > B with single-qubit cost tradeoff (multi-objective),,,,,,,,
S013,ext_2202_14025v1_legacy_claim5,2202.14025v1,non_specifiable,line 604,"routing/mapping subroutines is very similar for a wide range of values of k according to CX count overhead metric. Both algorithms show somewhat diﬀerent performance according to CX depth overhead, where Transpile (Qiskit)",routing/mapping on random k-regular graphs,Qiskit Transpile,Pytket DefaultMapping,CX count overhead,A ~= B,,,,,,,,
S014,ext_2304_03829v1_claim4,2304.03829v1,non_specifiable,line 547,"illustrating that the circuit complexity is signiﬁcantly higher (on average, 6,981.6) when ESOP is applied after RTT preprocessing than when ESOP is applied without RTT preprocessing. This again suggests that function",oracle synthesis ESOP with vs without RTT preprocessing,ESOP without RTT preprocessing,ESOP with RTT preprocessing,average circuit complexity,A < B,,,,,,,,
S015,ext_2305_03390v1_claim1,2305.03390v1,non_specifiable,line 427,"consistently outperforms the QUBO approach for higher order functions, as the expected value, the median and the overall variance are significantly lower for PUBO. This becomes increasingly apparent",continuous optimization with QAOA at higher-order objective functions,PUBO formulation,QUBO formulation,"expected value, median, and overall variance (multi-metric)",A > B (multi-objective with simulator-only context),,,,,,,,
S016,ext_2308_02536v1_legacy_claim1,2308.02536v1,non_specifiable,line 362,scheduling task even a vanilla PPO agent can learn policies which can outperform the standard priority-based ALAP approach. We demonstrate this finding in a proof of concept.,quantum circuit scheduling with commutation-aware compilation,PPO scheduling policy,priority-based ALAP,schedule length,A < B,,,,,,,,
S017,ext_2309_01028v2_claim4,2309.01028v2,non_specifiable,line 1054,"First, the ESOP synthesis and TBS methods provide different advantages: while ESOP nearly always produces circuits with lower complexity, TBS generally produces circuits with fewer qubits than ESOP synthesis. (See Figure",automated subcircuit synthesis,ESOP synthesis,TBS synthesis,circuit complexity vs qubit count (multi-metric tradeoff),A < B on complexity; A > B on qubits (multi-objective),,,,,,,,
S018,ext_2309_01028v2_claim5,2309.01028v2,non_specifiable,line 1068,"higher average complexity than ESOP synthesis without (6.981.6 versus 3, 769.5) further supports the conclusion that ESOP synthesis is able to substantially reduce cost by utilizing incompletely-specified functions.",automated subcircuit synthesis with vs without preprocessing,ESOP without preprocessing,ESOP with preprocessing,average circuit complexity,A < B,,,,,,,,
S019,ext_2409_15055v2_claim2,2409.15055v2,non_specifiable,line 899,"than QAOA without cd-terms. We have found that for MaxCut problem with N < 16, QAOA is more advantageous than DC-QAOA(NC), while for larger problems withN > 16, DCQAOA(NC) is superior. This refinement of the comparison",MaxCut by graph size,DC-QAOA(NC) at N>16 / QAOA at N<16,QAOA at N>16 / DC-QAOA(NC) at N<16,resource-adjusted performance,crossover at N=16,,,,,,,,
S020,ext_2411_00518v2_claim2,2411.00518v2,non_specifiable,,,knapsack QAOA across problem sizes,Copula-QAOA at small sizes / QTG-QAOA at large sizes,QTG-QAOA at small sizes / Copula-QAOA at large sizes,performance/efficacy,size-dependent crossover,,,,,,,,
S021,ext_2110_00592v2_claim1,2110.00592v2,boundary_or_no_design,line 801,"commutation rules, Nuwa uses approximately 34% fewer Swap gates than tket on average, and 66% fewer than",,,,,,,,,,,,,
S022,ext_2110_00592v2_claim2,2110.00592v2,boundary_or_no_design,,,,,,,,,,,,,,,
S023,ext_2110_00592v2_claim4,2110.00592v2,boundary_or_no_design,line 736,"Nuwa outperforms other algorithms by a signiﬁcant margin, both with and without applying commutation",Nuwa routing/mapping,Nuwa,other algorithms (vague class),Swap gate count (implicit),A < B,,,,,,,,
S024,ext_2206_09938v2_claim2,2206.09938v2,boundary_or_no_design,line 524,"Additionally, we also show in Figure 3 that this gain is not won at the cost of total two-qubit gates – the latter remains",,,,,,,,,,,,,
S025,ext_2208_13380v2_claim2,2208.13380v2,boundary_or_no_design,line 1064,"Secondly, the simulated trajectories are consistently slower than the measured trajectories; e.g. at ξ = 0.01 Φ0, the",nonstandard two-qubit Cartan trajectory simulation,measured Cartan trajectories,simulated Cartan trajectories,trajectory speed,A > B,,,,,,,,
S026,ext_2303_02830v1_claim1,2303.02830v1,boundary_or_no_design,,,,,,,,,,,,,,,
S027,ext_2405_09169v3_claim4,2405.09169v3,boundary_or_no_design,line 17,"on multiple QPUs (IonQ, Quantinuum, IBM) with up to Nq = 109 qubits, p = 100, and circuits requiring 21,200 CNOT gates. Finally, we present a noise model based on two-qubit gate counts",LR-QAOA hardware demonstration on QPUs,LR-QAOA at 109 qubits / p=100,(implicit) smaller prior QPU runs,qubits/layers/CNOT count attained,scale demonstration,,,,,,,,
S028,ext_2408_13316v2_claim2,2408.13316v2,boundary_or_no_design,line 119,• We demonstrate that QuCLEAR is effective in optimizing logical circuits and may outperform hardware-aware algorithms when mapping to devices with limited connectivity,logical-circuit optimization under limited connectivity,QuCLEAR,hardware-aware algorithms,optimization quality,A > B (hedged),,,,,,,,
S029,ext_2409_14786v3_claim3,2409.14786v3,boundary_or_no_design,line 1533,Parity QAOA circuit has a depth 5 times smaller than the vanilla QAOA circuit. For the complete graph with,hypergraph QAOA depth (small problems),Parity QAOA,vanilla QAOA,CNOT depth,A < B,,,,,,,,
S030,ext_2409_14786v3_claim4,2409.14786v3,boundary_or_no_design,line 1540,"comprises about 3 .1 times fewer and the circuit for the 4-regular graph N = 8 has 2 .5 times fewer gates. However, the Parity QAOA circuit for the complete graph",hypergraph QAOA CNOT count (small problems),Parity QAOA,vanilla QAOA,CNOT gate count,A < B,,,,,,,,
S031,ext_2007_15671v1_claim3,2007.15671v1,non_scalar_specifiable,line 116,"show that TB-OLSQ is nearly optimal and is able to increase fidelity by 1.30x in geomean, compared to TriQ [15], a leading academic",,,,,,,,,,,,,
S032,ext_2007_15671v1_claim4,2007.15671v1,non_scalar_specifiable,,,,,,,,,,,,,,,
S033,ext_2007_15671v1_claim5,2007.15671v1,non_scalar_specifiable,line 889,"some larger programs. In some cases, TriQ has slightly better fidelity results by leveraging larger depths. This is expected since TB-OLSQ-Fidelity optimizes fidelity with the fewest transitions",,,,,,,,,,,,,
S034,ext_2009_13545v3_claim1,2009.13545v3,non_scalar_specifiable,line 13,"an electronic H 4 Hamiltonian and a single-transmon quantum simulation. In all cases, the metaVQE is able to learn the shape of the energy functional and, in some cases, resulted in improved accuracy in comparison to individual VQE optimization. The meta-VQE algorithm introduces both",,,,,,,,,,,,,
S035,ext_2009_13545v3_claim3,2009.13545v3,non_scalar_specifiable,line 532,"standard VQE. Since we use ﬁve training points, optnl-meta-VQE becomes cheaper when more than 20 test points are required. Note that those numbers should",,,,,,,,,,,,,
S036,ext_2101_08526v7_claim1,2101.08526v7,non_scalar_specifiable,,,PDS variational quantum solver,PDS(K)-VQS,conventional VQE and original static PDS,accuracy and efficiency,A > B,,,,,,,,
S037,ext_2101_10296v3_claim3,2101.10296v3,non_scalar_specifiable,line 67,"solvers, we observe a median speedup of 8 .96 and a mean speedup of over 2726. In practice, the beneﬁts of using the",QAOA automorphism reduction,automorphism-reduced QAOA,baseline QAOA,speedup (aggregate),A > B,,,,,,,,
S038,ext_2102_00345v2_claim3,2102.00345v2,non_scalar_specifiable,line 16,"accuracy. Finally, we show that SPQE performs similar to, and in some cases, better than selected configuration interaction and the density matrix renormalization group on 1–3 dimensional strongly",strongly correlated H10 energy estimation,SPQE,selected configuration interaction and DMRG,energy accuracy per variational parameter,A >= B,,,,,,,,
S039,ext_2107_08606v3_claim1,2107.08606v3,non_scalar_specifiable,line 14,"static ansatz by utilizing fewer quantum resources and with a smaller quantum depth on average, in presence and absence of quantum noise, and in cases when the number of qubits or condition",VQLS adaptive ansatz design,adaptive dynamic ansatz (ADA),standard static ansatz (ASA),quantum resources and circuit depth,A < B,,,,,,,,
S040,ext_2107_08606v3_claim2,2107.08606v3,non_scalar_specifiable,line 254,Table S9 it is clear that Pennylane-qulacs is on average about 2 times faster than Pennylane default and about 3,,,,,,,,,,,,,
S041,ext_2110_10788v3_claim1,2110.10788v3,non_scalar_specifiable,line 12,"(MaxCut), but can easily calculate other problems related to graphs. Here, I present a novel quantum optimization algorithm which uses exponentially less qubits as compared to the QAOA while requiring a signiﬁcantly reduced number of quantum operations to solve the MaxCut problem. Such an improved p",log-qubit MaxCut algorithm,proposed log-qubit MaxCut algorithm,QAOA,qubit count and quantum operations,A < B,,,,,,,,
S042,ext_2111_13454v3_claim4,2111.13454v3,non_scalar_specifiable,,,VQA optimizer convergence behavior,SPSA,CMA-ES,convergence speed and spread in final energy error,A > B,,,,,,,,
S043,ext_2112_03199v4_claim2,2112.03199v4,non_scalar_specifiable,,,,,,,,,,,,,,,
S044,ext_2202_14025v1_legacy_claim1,2202.14025v1,non_scalar_specifiable,line 461,"set by Rebase (Arline). It is interesting to note that Qiskit, Pytket and Cirq were able to compress input circuits to the optimal ones with optimal CX and U3 gate counts. This shows that KAK decomposition is in-build in the",two-qubit KAK benchmark compression,Qiskit/Pytket/Cirq pipelines,KAK optimal bound,CX and U3 gate counts,A == B,,,,,,,,
S045,ext_2202_14025v1_legacy_claim13,2202.14025v1,non_scalar_specifiable,line 958,that QiskitPl and PytketPl demonstrate similar compression performance on average successfully improving the circuit cost function.,structured circuit compression,QiskitPl,PytketPl,compression performance and circuit cost improvement,A ~= B,,,,,,,,
S046,ext_2202_14025v1_legacy_claim19,2202.14025v1,non_scalar_specifiable,line 1281,"For quantum chemistry (UCCSD) circuits, we observe that PytketChem and FullReduce show the best performance according to CF (1Q) and CF (2Q) compression ratios as the overall circuit cost, which is in agreement with the",UCCSD subroutine ranking,PytketChem and FullReduce,other subroutines,"CF(1Q), CF(2Q), and circuit cost",A > B,,,,,,,,
S047,ext_2202_14025v1_legacy_claim3,2202.14025v1,non_scalar_specifiable,line 528,"In Fig. 6 we compare performance of quantum compilers for the task of compression of randomly generated threequbit circuits. Pytket achieved the best compression results for both CX and single-qubit gate counts, although Pytket still was not able to reach the theoretical upper bound on the CX count ",three-qubit random circuit compression,Pytket,Qiskit/Cirq/PyZX competitors,CX and single-qubit gate count compression,A > B (multi-objective),,,,,,,,
S048,ext_2204_10741v2_claim1,2204.10741v2,non_scalar_specifiable,,,QKS excited-state eigensolver,QDavidson,existing QKS methods such as QLanczos,convergence speed and circuit depth,A > B,,,,,,,,
S049,ext_2204_13719v3_claim2,2204.13719v3,non_scalar_specifiable,,,MQT Bench benchmark generation,Qiskit benchmark generation,TKET benchmark generation,benchmark generation time and number of generated benchmarks,A > B,,,,,,,,
S050,ext_2206_06684v1_claim1,2206.06684v1,non_scalar_specifiable,,,,,,,,,,,,,,,
S051,ext_2209_02669v3_claim1,2209.02669v3,non_scalar_specifiable,line 17,architecture. Our optimized Toﬀoli gate implementation demonstrates an 18% reduction in inﬁdelity compared with the canonical implementation as benchmarked on IBM Jakarta with quantum process,,,,,,,,,,,,,
S052,ext_2209_02669v3_claim2,2209.02669v3,non_scalar_specifiable,line 423,"measured our optimized Toﬀoli gate, the canonical Toﬀoli gate, and the IBM Qiskit-compiled Toﬀoli gate average gate ﬁdelities to be 0 .864 ± 0.00166, 0.834 ± 0.00153, and 0 .828 ± 0.00166, respectively. Therefore,",,,,,,,,,,,,,
S053,ext_2002_11724v2_claim2,2002.11724v2,non_planning_record,,,excited-state energy estimation,VQD,SSVQE and MCVQE,energy accuracy,A > B,,,,,,,,
S054,ext_2002_11724v2_claim3,2002.11724v2,non_planning_record,line 360,"i), the VQD gives the most accurate oscillator strengths, which indicates that the method enables us to generate",transition oscillator-strength estimation,VQD,SSVQE and MCVQE,oscillator-strength accuracy,A > B,,,,,,,,
S055,ext_2102_06813v1_claim2,2102.06813v1,non_planning_record,line 1112,"Most graphs at n ≤ 9 exceed the Goemans-Williamson bound by p = 3 in these narrow distributions, indicating",MaxCut small graphs,QAOA p=3,Goemans-Williamson bound,approximation_ratio,A > B,,,,,,,,
S056,ext_2103_08563v3_claim2,2103.08563v3,non_planning_record,line 1107,"shown as the Heisenberg limit. VQPE is able to achieve substantially higher accuracy than idealized QPE for the same number of time steps per circuit, thus it is better suited for",VQPE vs quantum phase estimation,VQPE,idealized QPE,accuracy at same number of time steps per circuit,A > B,,,,,,,,
S057,ext_2107_08606v3_claim3,2107.08606v3,non_planning_record,,,VQLS total resource cost for high-condition matrices,ADA,ASA,total resource cost (TRC),A < B,,,,,,,,
S058,ext_2112_03199v4_claim3,2112.03199v4,non_planning_record,,,MaxCut clustering,normal QAOA,warm-start QAOA,runtime,A < B,,,,,,,,
S059,ext_2112_03199v4_claim4,2112.03199v4,non_planning_record,,,MaxCut clustering,VQE/classical algorithm,normal QAOA,energy_or_clustering_performance,A > B,,,,,,,,
S060,ext_2112_07416v2_claim3,2112.07416v2,non_planning_record,,,measurement allocation vs classical shadows,computational-basis-sampling method and GC grouping,LBCS and OGM classical-shadow approaches,number of measurements,A < B,,,,,,,,
S061,ext_2202_14025v1_legacy_claim8,2202.14025v1,non_planning_record,,,routing/mapping on target circuits and hardware architectures,Cirq GreedyRouting,Qiskit/Pytket routing methods,CX count/depth overhead,A > B,,,,,,,,
S062,ext_2204_10741v2_claim2,2204.10741v2,non_planning_record,,,six-spin QKS circuit-depth comparison,QDavidson,QLanczos,maximum gate depth for same energy accuracy,A < B,,,,,,,,
S063,ext_2204_10741v2_claim3,2204.10741v2,non_planning_record,line 553,it is noteworthy that the shots needed for QDavidson to converge are fewer than for the VQE procedure since the,QDavidson under finite-shot sampling,QDavidson,VQE procedure,shots needed to converge,A < B,,,,,,,,
S064,ext_2205_01192v1_claim1,2205.01192v1,non_planning_record,,,MaxCut random regular graph ansatz comparison,QAOA+,alternative multiangle QAOA ansätze,approximation ratio / performance,A > B,,,,,,,,
S065,ext_2205_01192v1_claim2,2205.01192v1,non_planning_record,,,QAOA+ vs standard QAOA,QAOA+,standard QAOA,approximation ratio,A > B,,,,,,,,
S066,ext_2205_01192v1_claim3,2205.01192v1,non_planning_record,line 275,"have observed that QAOA+ always gives higher approximation ratios than ma-QAOA does at equal parameter numbers, despite the fact that with the full 20 parameters ma-QAOA outperforms the maximally parameterized 17-parameter QAOA+.",QAOA+ vs ma-QAOA at equal parameter count,QAOA+,ma-QAOA,approximation ratio,A > B,,,,,,,,
S067,ext_2205_03441v1_claim4,2205.03441v1,non_planning_record,line 691,"ISM). Also, as it was mentioned, the Max-Cut problem translation to a quantum circuit needs less quantum gates and this allows, in the case of the real simulations, to maintain a lower number of quantum gates compared with the",QAOA problem-family implementation,Max-Cut translation,ISM translation,quantum_gate_count_and_closeness_to_optimum,A < B,,,,,,,,
S068,ext_2212_11405v1_claim2,2212.11405v1,non_planning_record,line 558,"stretched H4 molecule in panel (a) of Fig. 3, we note a faster convergence of the Qubit-ADAPT-VQE-SCF algorithm on the basis of a JW mapping in contrast to a BK mapping. Furthermore, similar to the fermionic ADAPT case,",Qubit-ADAPT-VQE-SCF mapping choice,Jordan-Wigner mapping,Bravyi-Kitaev mapping,convergence speed,A > B,,,,,,,,
S069,ext_2212_11405v1_claim3,2212.11405v1,non_planning_record,,,NO ground-state ADAPT-VQE-SCF ansatz construction,Qubit-ADAPT-VQE-SCF,fermionic ADAPT-VQE-SCF,CNOT gate count,A < B,,,,,,,,
S070,ext_2301_00520v2_claim5,2301.00520v2,non_planning_record,line 870,D-Wave devices performance diﬀerences: One last observation from Figure 6 is that there a small but consistent performance diﬀerence between the two quantum annealers; the slightly older generationAdvantage system4.1 yields lower mean energy thanAdvantage system6.1. Simulated annealing is comparable,higher-order Ising quantum annealing,Advantage system4.1,Advantage system6.1,mean_energy,A < B,,,,,,,,
S071,ext_2007_15671v1_claim2,2007.15671v1,scalar_planning_record,,,,,,,,,,,,,,,
S072,ext_2008_02941v2_claim3,2008.02941v2,scalar_planning_record,,,,,,,,,,,,,,,
S073,ext_2009_03351v3_claim2,2009.03351v3,scalar_planning_record,,,,,,,,,,,,,,,
S074,ext_2011_08137v3_claim2,2011.08137v3,scalar_planning_record,,,,,,,,,,,,,,,
S075,ext_2011_08137v3_claim4,2011.08137v3,scalar_planning_record,line 619,"Tables I and II, on the other hand, indicates that the HONO/LUNO active space leads to a slightly shorter",,,,,,,,,,,,,
S076,ext_2011_12191v4_claim1,2011.12191v4,scalar_planning_record,,,,,,,,,,,,,,,
S077,ext_2011_12191v4_claim2,2011.12191v4,scalar_planning_record,line 918,"T. Hence, in CNOT-OPT-A this eﬀect is mitigated to some extent by conﬁning this reduction in shorter segments, leading to a better performance compared to CNOT-OPT-B.",,,,,,,,,,,,,
S078,ext_2011_12191v4_claim5,2011.12191v4,scalar_planning_record,line 924,"with these software packages. Despite such diﬀerence, our CNOT-OPT-A algorithm gives much less overhead compared to Qiskit and TKET in most cases.",,,,,,,,,,,,,
S079,ext_2102_00345v2_claim1,2102.00345v2,scalar_planning_record,line 13,"employing a fixed ansatz, we find that PQE can converge disentangled (factorized) UCC wave functions to essentially identical energies as variational optimization while requiring fewer computational resources. A comparison of SPQE and adaptive variational quantum algorithms shows that—for",,,,,,,,,,,,,
S080,ext_2110_00592v2_claim3,2110.00592v2,scalar_planning_record,,,,,,,,,,,,,,,
S081,ext_2111_03016v3_claim3,2111.03016v3,scalar_planning_record,,,,,,,,,,,,,,,
S082,ext_2202_14025v1_legacy_claim22,2202.14025v1,scalar_planning_record,line 1295,"Trotter decomposition circuits, subroutines PytketChem and FullReduce demonstrate the best and the worst two-qubit gates count compression performance, which also matches conclusions of in accordance to Section 5.2. In the case of",,,,,,,,,,,,,
S083,ext_2205_01726v1_claim1,2205.01726v1,scalar_planning_record,,,,,,,,,,,,,,,
S084,ext_2205_01726v1_claim5,2205.01726v1,scalar_planning_record,,,,,,,,,,,,,,,
S085,ext_2206_06684v1_claim2,2206.06684v1,scalar_planning_record,,,,,,,,,,,,,,,
S086,ext_2211_07685v3_claim3,2211.07685v3,scalar_planning_record,line 32,"qubit rotations and controlled two-qubit gates on FPGA chip s. In our benchmark with the QISKIT package, the depth of the circuits produ ced by the SQUANDER package (with the DFE accelerator support) were le ss by 97% on",,,,,,,,,,,,,
S087,ext_2301_00520v2_claim3,2301.00520v2,scalar_planning_record,line 654,performance. The 2-round QAOA results had better average energy compared the 1-round results in 6 out of the 10 problem instances.,,,,,,,,,,,,,
S088,ext_2302_04479v2_claim1,2302.04479v2,scalar_planning_record,,,,,,,,,,,,,,,
S089,ext_2302_04479v2_claim2,2302.04479v2,scalar_planning_record,,,,,,,,,,,,,,,
S090,ext_2302_04479v2_claim3,2302.04479v2,scalar_planning_record,,,,,,,,,,,,,,,
S091,ext_2304_08814v2_claim4,2304.08814v2,scalar_planning_record,line 371,"(ps) generates strictly less CNOTs than the naive decomposition, but the lookahead heuristic makes the algorithm slightly slower than naive. Re-synthesizing the trailing CNOTs is beneficial for circuits with more phase gadgets but for",synthesis algorithm comparison,ParitySynth (ps),naive decomposition,CNOT count,A < B,,,,,,,,
S092,ext_2305_03390v1_claim3,2305.03390v1,scalar_planning_record,line 667,"equally. When using a quantum circuit simulator however, the wallclock times for the PUBO formulations showed much better results, most probably because of the lower number of qubits that need to",,,,,,,,,,,,,
S093,ext_2306_02024v1_claim1,2306.02024v1,scalar_planning_record,line 334,"TTOpt outperforms the BFGS optimizer for L = 2 − 4 layers, but its convergence improves with L slower and",,,,,,,,,,,,,
S094,ext_2308_01789v1_claim1,2308.01789v1,scalar_planning_record,,,,,,,,,,,,,,,
S095,ext_2211_07685v3_claim1,2211.07685v3,non_exact_auditable,,,,,,,,,,,,,,,
S096,ext_2211_07685v3_claim2,2211.07685v3,non_exact_auditable,line 593,"9-qubit experiment we achieved a 467 times shallower circuit than with QISKIT. Except a single example of the program rd53_138, our results also surpass the",,,,,,,,,,,,,
S097,ext_2211_07685v3_claim4,2211.07685v3,non_exact_auditable,line 454,"According to our numerical experiments, the DFE implementa tion on a single FPGA chip can evaluate the cost function (1) and its gradi ent components by about (6 − 13)× faster than our CPU implementation on a computing server",,,,,,,,,,,,,
S098,ext_2212_11405v1_claim1,2212.11405v1,non_exact_auditable,line 491,"Interestingly, as we show below in Section III, even a minimal 1G-ADAPT-VQE scheme could lead in some cases not only to faster convergence but also to lower two-qubit (CNOTs) gate counts.",ADAPT-VQE-SCF gate addition strategy,1G-ADAPT / single-gate appending,5G-ADAPT / multiple-gate appending,convergence speed and CNOT count,A > B,,,,,,,,
S099,ext_2303_08910v3_claim1,2303.08910v3,non_exact_auditable,line 11,"with tensors constrained to certain Trotter circuits. Here, we determine the scaling of computation costs for various critical spin chains which substantiates a polynomial quantum advantage in comparison to classical MERA simulations based on exact energy gradients or variational Monte Carlo. Algori",critical spin-chain MERA simulation,TMERA VQE,classical MERA methods,computation-cost scaling,A > B,,,,,,,,
S100,ext_2304_03829v1_claim2,2304.03829v1,non_exact_auditable,line 550,"Fully-explicit function representations not only result in increased circuit complexity, but also in increased time-to-synthesis, which is again higher for TBS than for ESOP. (See Figure 9.) On average, synthesis time was",oracle synthesis from explicit function representations,ESOP synthesis,TBS synthesis,time-to-synthesis,A < B,,,,,,,,
